id|uuid|slug|title|description|startDate|endDate|updateDate|addedDate|numberOfDisciplines|numberOfTeams|totalCount|card_id|project_ids
1|e9ca8399-4b63-5d21-9e67-3b1c401870ce|e1aytxihy261e|2.5D Geometry Class|Add support for 2.5d geometry classes for area unification both visual and physical. |1617062400000|1618185600000|1611716252000|1629867600000|1|1|||SC,SQ42
2|dfce3b7d-0628-54db-ac70-3cb1c119a2cb|qyy206nmvogfb|890 Jump Mission Update|Update the Origin 890 Jump missions to support body dragging. This will enable the player to drag an unconscious NPC into a ship in the cargo hold to extract them. Includes both lawful and unlawful mission variants.|1609718400000|1623974400000|1608567374000|1629867600000|1|1|||SC
3|e834872d-f52c-59ee-8c56-baa2d96e73b2|sszqya69jci4s|Achievement Service|This service is responsible for the lifecycle and management of Game Achievements.|1629244800000|1644969600000|1611715233000|1629867600000|1|1|||SC
4|5100d8ca-6046-5ff2-b927-a91f53d90187|50p1qccyij9ay|Aciedo Station|Aciedo is a station created by Aciedo CommRelay, a Human corporation that manufactures and maintains interstellar communications equipment.|1614556800000|1632873600000|1608651688000|1629867600000|5|6|||SQ42
5|6f533924-a6d1-5adf-8f91-0f4ec37da5a1|mpn4648rn5dke|Actor Status T2|Actor Status Tier 2 looks at a variety of new elements such as hygiene, NPC status tracking, multiple bites, DNA integrity, medical insurance, cybernetic limbs and cloning.|1649030400000|1657238400000|1614048647000|1629867600000|2|1|||SC,SQ42
6|12fb985a-9aa8-5b14-abdf-ab3cec9847bf|i8lk92w7vy7mf|Adapt Spawn Closets to Support Persistent NPC Spawning|Tasks to update the Spawn Closet feature to work with the NPC scheduler service.|1624924800000|1628467200000|1608323230000|1629867600000|1|1|||SC
7|2ee23ab9-da7c-5962-8755-6b2b1a1c0082|87bzsnuy5led2|Aegis Gladius Gold Standard|Implementing, polishing, and optimizing all features required to bring the Aegis Gladius up to gold standard.|1610928000000|1615507200000|1608324345000|1629867600000|1|1|||SC,SQ42
8|04524e49-b508-5d08-89a8-f0d802223797|8zll1laek9mwr|Aegis Idris|Crafted by Aegis Dynamics, the Idris is the standard frigate used by the United Empire of Earth Navy (UEEN).|1614556800000|1632960000000|1608591465000|1629867600000|1|1|||SQ42
9|ca1fef9f-df74-5bda-a496-6003a7a7a20c|dkigidv85x2lg|Aegis Javelin Destroyer|Encompasses all tasks, including design, art, audio, and tech required for the implementation of the Aegis Javelin Destroyer.|1610928000000|1616716800000|1618799413000|1629867600000|3|2|||SC,SQ42
10|d95f1992-ed5a-5feb-9efa-ffd00202d9be|ghxuoc2lsveha|Aegis Redeemer|Encompasses all tasks, including design, art, audio, and tech, required for the implementation of the Aegis Redeemer gunship into the PU.|1610928000000|1633046400000|1629831434000|1629867600000|2|4||1|SC,SQ42
11|490a9ab9-b6a6-5086-814d-80d6bfbe1911|v1jqgsai92o1c|Aegis Retaliator Gold Standard|Implementing, polishing, and optimizing all features required to bring the Aegis Retaliator up to gold standard.|1609718400000|1625184000000|1608323947000|1629867600000|2|2|||SC,SQ42
12|41f8949a-5ebf-55ce-b7d2-f343949789b5|wmrdhc8v3u5ng|Aerodynamic Control Surfaces|Ships with control surfaces will be able to use them in atmospheres to aid their maneuverability. This will allow for improved performance from ships that have weak maneuvering thrusters in atmosphere, and bring new depth to aerodynamic flight in the game.|1652486400000|1656028800000|1628644587000|1629867600000|1|1|||SC
13|b1d0a5a8-139d-588c-856b-d2d143830004|uyxipjj3dgy9t|AI - Dancing|Dancing is a segment of our new civilian AI leisure behavior. After work, some civilians will have the urge to spend time at a nightclub and dance the night away. This will bring new life and movement to our bars.|1625184000000|1626393600000|1626278185000|1629867600000|1|1|||SC,SQ42
14|6c9aa672-5ba3-5049-b7e6-94afb8151f38|4vj9h90xhev8g|AI - Ground Vehicles|This is the first pass on supporting NPCs controlling and driving ground vehicles. This requires the implementation of a new pathfollower that can take care of the vehicle's physical abilities to transform the NPCs movement request into actual movement.|1626393600000|1631145600000|1627486371000|1629867600000|1|1|||SC
15|ecee59a0-0aeb-52a5-929f-460b38a0c5a3|vigi7e0mgr6fg|AI - Hawker|Encompasses all tasks for implementing the Hawker NPC type into the persistent universe.|1617580800000|1620259200000|1617824716000|1629867600000|2|2|||SC
16|95eaab12-f638-520e-b58e-7fae61266b06|0ew6itfmw7t95|AI - Illegal Goods Dealer|The &lsquo;Goods Dealer&rsquo; is a new roaming &lsquo;Vendor&rsquo; AI behaviour that brokers illegal products, located mostly wandering around shadowy and secretive areas, this dealer trades without a license or permission and is always on the lookout for security. |1620345600000|1632355200000|1626278577000|1629867600000|3|3|||SC
17|544658ab-d216-5c34-b388-40331e5dbbc3|e97z56j5onr8t|AI - Janitor|Encompasses all tasks for implementing the Janitor NPC type into the persistent universe.|1619136000000|1623888000000|1617824626000|1629867600000|3|2|||SC,SQ42
18|9cd1632b-4021-5011-a620-27f59eb0775b|qkqc94d0h7c3s|AI - Leisure|The leisure behavior is a segment of our new civilian behavior system, controlling how the AI behaves when they have free time during their schedule. AI will create a lifelike environment by relaxing and having fun, using the things that are available to them, such as exercise equipment, jogging routes, TV monitors, seats/benches, and their mobiGlas.|1628812800000|1631404800000|1626278163000|1629867600000|2|2|||SC,SQ42
19|20f35a62-ec55-538b-aa6e-eca11d444a14|si5i2wv4cow7k|AI - Medical|Implementing a variety of medical AI behaviors. A patient will arrive at the hospital and check themselves in at a terminal then wait to be seen called to a room for a diagnosis. The patient can then see doctors and nurses tending to sick and injured people. Other patients will wait to be called. Doctors and nurses can be seen washing their hands, checking medical stock and dispensing medicine. Some patients will be asleep in medical beds.|1628467200000|1632009600000|1628651189000|1629867600000|2|3||2|SC,SQ42
20|575444df-bee4-52a1-8faa-c241c26f5cac|j8gi3ozzvt6jv|AI - Navigation Links - Ladders/Ledge Grab|Implementing special adapters to allow the navigation system to be informed of potential navmesh connections offered by ladders or ledge grab markup. The navigation links already allowed the creation of adapters that contain gamecode specific functionality to function as sort of translators between system-specific domain into the navigation system.|1628812800000|1629936000000|1626277713000|1629867600000|1|1|||SC,SQ42
21|c29bdb4e-0704-569d-ae62-009dc3a058eb|ghsh7sp3lflvf|AI - Off Duty Activities - Hygiene|The sleeping behavior is a segment of our new civilian behavior system, making the AI feel more realistic by scheduling toilet breaks, sometimes washing hands, and increasing hygiene values by taking daily showers.|1617926400000|1628726400000|1618972342000|1629867600000|2|1|||SC,SQ42
22|b0ae7b4d-7f20-55a1-807c-f6ec3243d739|7z4iivhbm4n5q|AI - Off Duty Activities - Sleeping|The sleeping behavior is a segment of our new civilian behavior system, controlling how the AI sleeps, relaxes, and socializes in bed. We will support single beds, bunk beds and beds with privacy shutters in this first iteration.|1616716800000|1631145600000|1618972325000|1629867600000|2|1|||SC,SQ42
23|9b38e427-85c3-50b7-8452-04f1d05b2514|3awo94sem3ynx|AI - Planetary Navigation|First pass at a system that allows NPCs to move on planetary surfaces using a dynamically generated navigation mesh. This will efficiently process planetary terrain and objects to prioritize the processing of the environment around the players into navmesh, allowing us to use all the existing functionalities on planets.|1620345600000|1631145600000|1621455588000|1629867600000|1|1|||SC
24|2c1b7cfb-cc6b-5656-b3ec-4b43dc9de856|yy640x1bb91gl|AI - Trolley Push &amp; Pull|This will be the first pass on implementing the ability for NPCs to use trolleys and trolley-like entities. They will be able to move in the environment pushing and pulling those entities to place them from/to specific locations. This requires the creation of a special pathfollower that can take into consideration external forces that needs to be balanced to achieve the desired speed.|1620345600000|1623888000000|1626277739000|1629867600000|1|1|||SC,SQ42
25|ff12a172-7ae4-573d-b9e3-5edd93223746|zips3284dxi5m|AI - Turret Gunner|Encompasses all tasks for implementing the Turret Gunner NPC type into the persistent universe.|1620604800000|1621123200000|1617824683000|1629867600000|1|1|||SC,SQ42
26|1e512b05-ccb6-5488-b515-dc6b143026b4|tpbm5w1b4ght9|AI - Unmanned Missile Turrets|Adding AI controlled missile turrets to improve defense of green zones.|1626393600000|1628726400000|1626278058000|1629867600000|1|1|||SC
27|5a28a84f-a183-5940-a2ad-731dbceaa2ab|bku4rtuqkyftw|AI - Untrained Combat|First iteration for untrained characters (such as civilians) to react in battle scenarios. Civilian AI will be able to use weapons to defend themselves in threatening situations, and will try to preserve their lives using cover or surrendering when necessary.|1616716800000|1632873600000|1621427028000|1629867600000|2|2|||SC,SQ42
28|092e8938-5094-526a-9dcc-541718b6fa5d|yq9axpywqqscy|AI EVA Tech|AI will be able to navigate via EVA in open space to appropriate points of interest and will allow the AI to transition from seat to EVA when requested or when appropriate.|1616716800000|1622678400000|1617826720000|1629867600000|1|1|||SC,SQ42
29|c8173325-f65b-59a2-97b6-0647c957c4d4|rfayfmf8yqrsz|AI Info Service|Currently, Odin and other backend tools that display player or NPC locations route through ElasticSearch, which is CIG's analytics pipeline. This process is naturally slow, and the amount of high-fidelity data we need to track is low enough to make a separate service practical. This new service will continuously track the position of players, NPCs, and other entities so that our live-service tools can display them properly in real-time.|1612137600000|1622160000000|1608569695000|1629867600000|1|1|||SC
30|8ae39f6e-ebdc-5066-8b0c-a15562b6f0bd|54wqvfmohiui8|Akiro Cluster|Adding the Akiro Cluster, a cluster of dangerous, charred asteroids. While mostly worthless, some rare materials can be found here.|1621296000000|1622505600000|1608565240000|1629867600000|1|1|||SC
31|fd04ff9a-ab32-5838-b972-10d3651db2c4|1plpc2394ak3w|Animatable Gunner Helmet|Creating an animated and EVA-capable version of the gunner helmet. |1623024000000|1632441600000|1617825781000|1629867600000|2|1|||SC,SQ42
32|4365e939-92df-5296-8388-db38af8aeb15|7n4pypxkvct2h|Aopoa San'tok.yāi|Building, balancing, and implementing Aopoa's medium fighter, the San'tok.yāi, into the game.|1633305600000|1651190400000|1629831559000|1629867600000|3|2|||SC
33|7a43e517-4f2f-5fc1-a3e8-6f393eb0e275|pzk7ai0l3hjmf|Archon|Archon Station is a large space station located inside The Coil.|1609718400000|1648512000000|1608651594000|1629867600000|1|1|||SQ42
34|16c496df-f35b-5a5d-9d29-62b31fb6bd8a|nom7e8ftjjgbf|Area 18 - Hospital Interior Location|Area 18 hospital interior where players can heal, revive, and purchase medical supplies and life insurance.|1613520000000|1637020800000|1628647166000|1629867600000|1|1||3|SC
35|ec64a91e-eb1f-5b3c-bfe6-306d4cf271fd|5d643vbvzi7xd|Asset Manager|In support of localized inventories, the Asset Manager keeps track of all player-owned items, where they're stored, and where they need to go to pick up, transfer, and equip them.    |1610928000000|1630627200000|1628649550000|1629867600000|3|3||4|SC
36|a484a400-e5f6-58d1-a663-a8c436536b30|3qtun6myee2l1|Asset Reference Database|Create a tool to track relationships and dependencies between assets and produce asset graphs showing how an in-game entity is composed. This will allow improvements to the build system and easier asset management. |1609891200000|1631664000000|1611718138000|1629867600000|1|1|||SC,SQ42
37|950508ba-96d0-5f92-a28f-8040a36cfe58|myxwb7fk5zplo|Asset Specific ADIK Targets - Maya|Implementation of a new maya workflow featuring a streamlined user interface for authoring asset specific ADIK targets that can be exported to engine on a per-animation basis.|1619481600000|1620604800000|1617825199000|1629867600000|1|1|||SC,SQ42
38|56e3d099-a71e-5856-9278-d6d919fa1ced|iawro74hcbfbp|Asset Validator|Replacement for the existing Asset Validator to provide extensible test plug-ins, improved performance, and clearer error reporting. |1613606400000|1628035200000|1611718411000|1629867600000|1|1|||SC,SQ42
39|2b187161-6e3e-58e9-b6c5-ae5ef2052949|6pvoowo3859ve|ATC Service|The logic for Air Traffic Control is handled separately on each DGS (Dedicated Game Server). As we move closer to the reality of Server Meshing, the logic for Air Traffic Control needs to transition to a separate service.|1609459200000|1625011200000|1608319588000|1629867600000|1|1|||SC
40|b6e904cb-597b-5209-9fd1-cea31fe1aeb1|gbuqyuf1dywz8|ATC System Rewrite|Rewrite the ATC system to utilize a backend service, making it compatible with server meshing.|1611619200000|1646092800000|1608323409000|1629867600000|2|3|||SC
41|ebea85ae-59d7-5a59-8e55-c8877229169e|vgcwo0ksddwmw|Atlas|Add functionality to the Hybrid for what will become the Atlas component service of the Replication Layer. Atlas functionality splits the game up into multiple manageble regions (known as territories) which are then provided to the Replicant functions Dedicated Game Servers (DGS) by the Replicant Hybrid  to manage and simulate.|1625270400000|1630022400000|1626278609000|1629867600000|1|1|||SC
42|6d9764a6-c678-59df-99ab-0c4b4703f1d4|xffyseweue5kz|Atmospheric Pressure Damage|Atmospheric Pressure Damage is the damage players/NPCs or ships will receive in situations where the exterior pressure exceeds the pressure resistance of the corresponding ship/armor/suit.|1624320000000|1636416000000|1624672224000|1629867600000|2|2|||SC
43|da9db229-fa27-55bd-a3bd-80ffd2e9086b|ndslm2squioma|Audio to Animation Toolset|Development of a toolset to analyze .wav audio files and create matching, believable facial animations that work with the game's current rigs.|1616976000000|1619395200000|1617825425000|1629867600000|1|1|||SC,SQ42
44|2949fb71-8452-5b26-98ca-011a33bb8ff8|hk26ryp4e9l2k|AWS Batch Interface|A cloud based batch solution utilising Amazon Web Servers to offload much of the conversion and export work from users machines to speed up their workflows.|1621900800000|1623024000000|1617825240000|1629867600000|1|1|||SC,SQ42
45|09d81b8a-a0f7-581e-9ae8-6cd0e40f4e5d|2faqr0u5elwn7|Backpacks|Concepting and creating generic backpacks to support physicalized inventory, as well as developing a scalable system for equipping backpacks onto a variety of armors. |1619395200000|1632441600000|1617826533000|1629867600000|3|2|||SC
46|1b6678e1-c645-5e15-a5a0-bc3e5c46b0a5|wgncoopr3uw8f|Banu Merchantman|Building, balancing, and implementing the Merchantman, the Banu-made trading vessel, into the game.|1609718400000|1655424000000|1620230026000|1629867600000|2|2|||SC
47|489d6b0c-8007-5d01-9faa-0e6ce10714e3|l89dvykyssb6o|Basilisk Advocacy Undersuit|Encompasses all tasks related the Advocacy undersuit made by Basilisk.|1616976000000|1627603200000|1617844897000|1629867600000|1|1|||SC,SQ42
48|b16db1e6-d713-5efe-8e16-a3cdf56ea644|i5p0qizcn146z|Behring S7 Ballistic Gatling|Designing and creating the Behring S7 Ballistic Gatling ship weapon. Includes asset creation, animation, and balancing.|1613347200000|1631491200000|1629831443000|1629867600000|1|2||5|SC,SQ42
49|77f8576d-c743-5c9b-8600-5306735437ed|sx9de473s0ht0|Behring S7 Laser Cannon|Designing and creating the Behring S7 Laser Cannon ship weapon. Includes asset creation, animation, and balancing.|1610928000000|1631491200000|1629831442000|1629867600000|1|2||6|SC,SQ42
50|f507d980-e38a-5a86-9fab-87d8af510c21|1mcecd88blnft|Bespoke Take &amp; Place|Definable and bespoke take and place animations actions for specific items. For example, the take and place animation for a helmet should be different from a bottle or grenade.|1624579200000|1628121600000|1608671968000|1629867600000|1|1|||SC,SQ42
51|d2c2ee74-cd70-53d5-bd3f-3d7da4e8ee32|mt4hky75vzjga|Boat Movement Parameters|Creation and support for a new vehicle movement simulation and movement type for use with boats or other aquatic vehicles.|1617580800000|1624579200000|1608591603000|1629867600000|2|1|||SQ42
52|4c105729-fba9-54ae-8a58-75649b47a111|7kfxh3qa8d1ez|Bombs|These systems will allow players in certain ships to drop a variety of powerful bombs over targets in atmosphere.|1609891200000|1633046400000|1629831442000|1629867600000|4|6||7|SC
53|2874a294-1f3c-5e45-82ea-178d4d45e733|3ncw9nonyc0i7|Boreal Stalker|Implementing the boreal stalker creature into the game. Created by microTech genetic engineers to fill the apex predator niche wthin their planet's ecosystem, the boreal stalker roams its tundras searching for prey.|1621814400000|1627603200000|1618972296000|1629867600000|1|1|||SC
54|541d5267-fcff-5df7-9e85-1b4c5e93b962|sweea1bv8b2f9|Bounty Hunter V2|Enabling players to track criminals via a mobiGlas security app linked to distress beacons, comm arrays, air traffic control systems, cameras, and NPC informants. This will rely on various new backend tech, including Virtual AI, the NPC Scheduler, and Security Service.|1641254400000|1646092800000|1608323694000|1629867600000|1|1|||SC
55|dd333b52-7abd-53e7-ac8c-5b1bb629c8d8|ydswuuwzevzou|Breakers Yard|Breakers Yard is an environmental location hidden deep within Odin I.|1609718400000|1640908800000|1608671627000|1629867600000|2|1|||SQ42
56|89fd34fe-b8ce-5c82-a304-620e20056da7|oouhlnscv4cqu|Bug Fixing &amp; Tech Debt|General bug-fixing and optimization for all game features and backend tech. |1609459200000|1657238400000|1608324626000|1629867600000|6|33|||SC,SQ42
57|81d27db2-5c26-5085-884c-f1b2c2869a7e|jazhdlezv8h3w|Building Blocks Shop Conversion|Convert the UI used when visiting item shops to work with Building Block technology and prepare the layout for the upcoming Organizational Perks.|1609718400000|1615507200000|1608318773000|1629867600000|1|1|||SC
58|606acb1e-50ce-5dd2-8ee2-f161399d90ca|rm4sptqkc0xlx|Building Interiors|Create gameplay focused layouts to fill the interiors of the various buildings in landing zones.|1613433600000|1654214400000|1617828146000|1629867600000|2|2|||SC
59|3873dbe3-c1ed-5caf-a6fb-bb5b03bce830|42e91zsr4xs2f|Cargo System Refactor |Refactor to allow both found and purchased cargo to be picked up, moved around, and placed into the cargo grid of a ship.|1609718400000|1638489600000|1608318910000|1629867600000|2|2|||SC
60|eb3534b7-8aa8-53b8-9cd7-2ab3a89dfa90|839u9uuwgg78p|Cave Improvements|Adding two new cave entrances to the PU. The 'drive-in' entrance will allow players to enter using a ground vehicle, while the 'sinkhole' entrance will require players to enter and exit using a ship.|1609804800000|1617062400000|1617820309000|1629867600000|2|2||8|SC
61|0be200be-76b7-5a6b-bbb1-e37cbc83acb0|p6q8plpm8dovk|Chapter 01|Designing, implementing, and iterating on chapter 1 of Squadron 42's single-player campaign. |1609459200000|1640908800000|1611710577000|1629867600000|3|7|||SQ42
62|413f86e1-daea-51ac-944a-30456782bc44|8t07kw90qvhf0|Chapter 04|Designing, implementing, and iterating on chapter 4 of Squadron 42's single-player campaign. |1609459200000|1640908800000|1611710582000|1629867600000|2|3|||SQ42
63|cf52ed22-a9ea-56e7-af87-3c68e4edd293|ase8e8mmixff4|Chapter 05|Designing, implementing, and iterating on chapter 5 of Squadron 42's single-player campaign. |1609459200000|1651795200000|1611710564000|1629867600000|3|5|||SQ42
64|9eceefc1-fd12-5840-be4f-922c81cd2b31|qrpp0jelcpx8y|Chapter 06|Designing, implementing, and iterating on chapter 6 of Squadron 42's single-player campaign. |1609459200000|1640908800000|1611710482000|1629867600000|2|3|||SQ42
65|9362920f-f6f2-54e5-8096-4c9125363d6a|55ihw5xes1jpp|Chapter 07|Designing, implementing, and iterating on chapter 7 of Squadron 42's single-player campaign. |1609891200000|1640908800000|1611710560000|1629867600000|2|3|||SQ42
66|ae7e2980-2186-5019-8aea-13bd95ba55e4|aoa32y9xrqhd3|Chapter 08|Designing, implementing, and iterating on chapter 8 of Squadron 42's single-player campaign. |1609459200000|1640908800000|1611710507000|1629867600000|2|3|||SQ42
67|47ed4f3b-92bb-5522-adda-f46c0a197458|51lg16ocusxjo|Chapter 09|Designing, implementing, and iterating on chapter 9 of Squadron 42's single-player campaign. |1609891200000|1640908800000|1611710547000|1629867600000|2|3|||SQ42
68|cdb45386-161c-5e5a-b47e-a1d9d6514438|8lu3osgro9jz1|Chapter 10|Designing, implementing, and iterating on chapter 10 of Squadron 42's single-player campaign. |1609891200000|1640908800000|1611710552000|1629867600000|2|3|||SQ42
69|f7696dc7-90f2-536c-aa0f-fada1282edbe|z97whnirtcy29|Chapter 11|Designing, implementing, and iterating on chapter 11 of Squadron 42's single-player campaign. |1609459200000|1640908800000|1611710524000|1629867600000|4|6|||SQ42
70|5a6ceab1-b70b-5748-a7d8-30415c92418d|3mwo1tt5tkkl6|Chapter 12|Designing, implementing, and iterating on chapter 12 of Squadron 42's single-player campaign. |1609891200000|1640908800000|1611710572000|1629867600000|2|5|||SQ42
71|fbc5a77b-3ac5-5d6a-af38-95e551c2360f|m4hon3qy5aj7j|Chapter 13|Designing, implementing, and iterating on chapter 13 of Squadron 42's single-player campaign. |1619827200000|1632960000000|1611710543000|1629867600000|2|2|||SQ42
72|72b7e18b-3221-527a-ab15-e16f67f2ed5a|muo5mcszz0enx|Chapter 14|Designing, implementing, and iterating on chapter 14 of Squadron 42's single-player campaign. |1609459200000|1640908800000|1611710499000|1629867600000|2|4|||SQ42
73|59f104cd-16a9-56a7-abb8-315883330a51|x9clnqkpeqnf4|Chapter 15|Designing, implementing, and iterating on chapter 15 of Squadron 42's single-player campaign. |1609459200000|1640908800000|1611710568000|1629867600000|2|3|||SQ42
74|31bfabfe-9aa3-566e-aaf0-f8c8f8a54349|i8g9fwso33dsp|Chapter 16|Designing, implementing, and iterating on chapter 16 of Squadron 42's single-player campaign. |1609891200000|1625011200000|1611710489000|1629867600000|1|3|||SQ42
75|628e2aa9-aa9d-57e8-aa46-4a0ccf348a31|a9rux14dc5wdj|Chapter 17|Designing, implementing, and iterating on chapter 17 of Squadron 42's single-player campaign. |1609459200000|1640908800000|1611710513000|1629867600000|2|3|||SQ42
76|098de177-c091-582d-a798-f86fc85cb6d6|4sbmlw2c4by8m|Chapter 18|Designing, implementing, and iterating on chapter 18 of Squadron 42's single-player campaign. |1609459200000|1640908800000|1611710361000|1629867600000|2|4|||SQ42
77|0bddbf21-f060-516a-b0c2-c9c7cbab0c3a|oj3oi90mrslpv|Chapter 19|Designing, implementing, and iterating on chapter 19 of Squadron 42's single-player campaign. |1609459200000|1640908800000|1611710555000|1629867600000|2|3|||SQ42
78|485d60e8-f4c8-5a37-82a5-f48da2830a08|51czsbt2ajcs1|Chapter 20|Designing, implementing, and iterating on chapter 20 of Squadron 42's single-player campaign. |1609891200000|1640908800000|1611710458000|1629867600000|3|5|||SQ42
79|9b9f49ee-3124-5f33-915d-caa7d49510d8|kfhortybw0xo5|Chapter 21|Designing, implementing, and iterating on chapter 21 of Squadron 42's single-player campaign. |1622419200000|1640908800000|1611710445000|1629867600000|2|3|||SQ42
80|177b6e40-a13f-5a28-b303-ffa7c13cad08|y1b9hiipoykw3|Chapter 22|Designing, implementing, and iterating on chapter 22 of Squadron 42's single-player campaign. |1609459200000|1640908800000|1611710438000|1629867600000|2|3|||SQ42
81|85bfc9be-066a-560e-ad90-0a0eaa16ebaa|7cnbz3e3830yf|Chapter 23|Designing, implementing, and iterating on chapter 23 of Squadron 42's single-player campaign. |1619827200000|1640908800000|1611710431000|1629867600000|2|3|||SQ42
82|53b8519b-d431-57b6-aba4-ffdc807adb7d|remmqkmi3p4vg|Chapter 24|Designing, implementing, and iterating on chapter 24 of Squadron 42's single-player campaign. |1620000000000|1640908800000|1611710424000|1629867600000|3|3|||SQ42
83|3a56a750-2d60-5b82-838e-70459f7a0ce1|vel8t7l1cg3vr|Chapter 25|Designing, implementing, and iterating on chapter 25 of Squadron 42's single-player campaign. |1623628800000|1640908800000|1611710418000|1629867600000|2|3|||SQ42
84|caa4ae4b-68ba-5bc0-a1e3-6a429c0b3b07|9pyp286qji194|Chapter 26|Designing, implementing, and iterating on chapter 26 of Squadron 42's single-player campaign. |1609459200000|1651795200000|1611710410000|1629867600000|4|4|||SQ42
85|70dace0c-ebf3-5915-81cf-922f126ddb07|qajtops3o8khz|Chapter 27|Designing, implementing, and iterating on chapter 27 of Squadron 42's single-player campaign. |1612137600000|1648512000000|1611710405000|1629867600000|3|2|||SQ42
86|e523b6de-4806-5d5a-b724-3ffa860c794f|h9jdz5m3wyjmf|Character Attachment Volumes|Volume guidelines for weapon and item attachments on characters to allow for better design implementation from the concept phase. |1616976000000|1622764800000|1617826438000|1629867600000|1|1|||SC,SQ42
87|3cac1b56-f935-52b6-90a2-0018e4263468|xcm71052agqrb|Character Work|Creation and implementation of various characters in Squadron 42's single-player campaign, including art, animation, and AI behavior.|1616716800000|1632873600000|1617827504000|1629867600000|5|7|||SQ42
88|c42b8de1-c8c6-5747-b9b8-89f34dca6d32|kte875wgl8xdk|Charge/Drain T0|All back-end tech tasks related to creating the first pass of the charge/drain power feature that will be used in future location and mission updates.|1614556800000|1617926400000|1617820776000|1629867600000|2|1||9|SC,SQ42
89|8dfbdead-ca69-52e7-8dbe-c144fdbf23ea|tyrxgnrl2c0c5|Checkpoint - Restore Ship State |Once implemented, re-loading from a checkpoint will restore the ship state when it was saved, or in a designer specified state.|1630886400000|1631836800000|1608564628000|1629867600000|1|1|||SQ42
