id|uuid|slug|title|description|startDate|endDate|updateDate|addedDate|numberOfDisciplines|numberOfTeams|totalCount|card_id|project_ids
699|3873dbe3-c1ed-5caf-a6fb-bb5b03bce830|42e91zsr4xs2f|Cargo System Refactor |Refactor to allow both found and purchased cargo to be picked up, moved around, and placed into the cargo grid of a ship.|1609718400000|1646092800000|1637182449000|1639461600000|3|4||114|SC
700|c42b8de1-c8c6-5747-b9b8-89f34dca6d32|kte875wgl8xdk|Charge/Drain T0|All back-end tech tasks related to creating the first pass of the charge/drain power feature that will be used in future location and mission updates.|1614556800000|1660780800000|1617820776000|1639461600000|3|2|||SC,SQ42
701|6bb2e3a6-7874-58af-b606-201040242b82|4y0iw4tc02r1u|Commodity Kiosk|Converting the commodity kiosks to utilize Building Blocks. This will also add loading timers, which will need to be factored-in when planning cargo runs.|1610928000000|1646092800000|1608318786000|1639461600000|2|1|||SC
702|bbcbd952-a56a-5e4b-9cee-ac0cd1962d4b|gpgt0at1a4v61|Crusader Ares Starfighter Inferno|Building, implementing, and balancing the Crusader Ares Starfighter Inferno as a flight-ready vehicle.|1616371200000|1636675200000|1637110298000|1639461600000|3|5||115|SC
703|83f12632-5dc1-5086-8a57-aa9da8901e27|3ah930y2qmv2b|Crusader Ares Starfighter Ion|Building, implementing, and balancing the Crusader Ares Starfighter Ion as a flight-ready vehicle.|1616371200000|1636675200000|1637110298000|1639461600000|3|5||116|SC
704|1677911b-0c8a-527a-a5f2-0a33a3b49db8|le5xpn8yt0qjx|Crusader Genesis Starliner|Building, implementing, and balancing Crusader's passenger transport, the Genesis Starliner, as a flight-ready vehicle.|1661126400000|1664496000000|1628716052000|1639461600000|1|1|||SC
705|974748ca-6749-5965-88b5-b3562d9bb0af|p6ad2qrfqj1gv|Curelife Medical Tool|Create a Curelife-branded medical tool for use in the field and within hospitals. This will be used by medics instead of the Multi-Tool.|1618185600000|1630022400000|1637110291000|1639461600000|3|4||118|SC,SQ42
706|7cd631d1-8803-54d3-a405-50c1f6189d90|tqg3c7qk5spp8|Cutting T2|All back end tech tasks related to updating the cutting feature for the multi-tool that will be used in future location and mission updates. The continued development of the existing Multi-Tool technology will allow players to cut through specific objects. This will primarily include the ability to free-form cut on specific surfaces.|1660867200000|1664409600000|1627485624000|1639461600000|1|1|||SC,SQ42
707|77113c26-4647-5cd0-ba57-c1fcc57e2da4|7gn65uaicgfru|Datacore Deserializer |A C++ Star Service that uses the normal game tech to read the DataCore data - whether that be in binary format or loose files - and exposes it via a Diffusion API.|1648598400000|1663200000000|1608319028000|1639461600000|1|1|||SC
708|8cb749fe-98ef-54b1-99a8-be6cebf7eee6|gc9nco1v95l85|Derelict Spaceships - Points of Interest|Points of interest that will be scattered on planets. They will be derelict spaceships with some type of activity (puzzle, traversal, hostile AI) and some type of reward for resolving said activity.|1617321600000|1663200000000|1637110174000|1639461600000|2|4||119|SC
709|aea81bff-a5f7-5767-afbd-8ab0f842880a|8y2u9zjn9r2rk|DNA Head Textures Update|Texture updates for DNA head archetypes that will improve texture quality for all DNA heads in Star Citizen and Squadron 42.|1633910400000|1638489600000|1637109448000|1639461600000|1|1||120|SC,SQ42
710|a9eef620-e639-5f48-ba71-b3ad829ea88d|3o9djlbhpahrw|Docking - Ship to Ship|All tasks related to the feature that allow smaller ships to dock in larger ships while in space.|1610928000000|1617321600000|1620959289000|1639461600000|1|1|||SC,SQ42
711|42bdcb58-1a6e-5164-bebe-4f2605ba9540|eutanhjsikw9s|Drake Corsair|Building, balancing, and implementing Drake Interplanetary's multi-crew explorer, the Corsair, into the game.|1618185600000|1660780800000|1620230014000|1639461600000|2|3|||SC
712|230d91c3-8483-5506-a8ec-9a24764fba83|fp3hpb2kmqs6j|Drake Cutlass Gold Standard|Implementing, polishing, and optimizing all features required to bring the Drake Cutlass to gold standard.|1661126400000|1663286400000|1637111256000|1639461600000|1|1|||SC,SQ42
713|f984a852-457f-5610-b812-7af746c7fd88|7ruthnrbdma5s|Drake Vulture|Building, balancing, and implementing Drake Interplanetary's light salvage ship, the Vulture, into the game.|1622419200000|1647302400000|1637110258000|1639461600000|3|2||100|SC
714|36927d51-d282-5ac4-a771-ab27de632d18|8ngiz6vlycmn8|Dynamic Events|Continued work on backend tech to support the development of Dynamic Events in Star Citizen's ever expanding universe.|1609718400000|1646092800000|1608694723000|1639461600000|4|8|||SC
715|11648a7d-623c-5d1e-92af-99af761a2a1f|2cz6a6347gm0x|Enemy Characters|Encompasses all tasks related to an enemy faction's characters in Squadron 42.|1616716800000|1638489600000|1617827618000|1639461600000|4|3|||SQ42
716|ab0acb30-6d36-51d5-9d45-3a1176c5bd70|2p5u3dszua62u|Error Reporting &amp; Crash Handling|Unify and normalize crash handling across environments for clients, game server instances and services, to provide faster correlation of client crashes to backend and simulation crashes.|1609891200000|1664409600000|1611715498000|1639461600000|1|2|||SC
717|1f802039-c9bd-54a2-bf4a-6a7058cfa6e7|hmhfouy6flk5j|Flak Ammunition|This new damage type triggers on proximity or expiration, causing a concentrated burst of shrapnel to damage targets in an area.|1657238400000|1660780800000|1637111134000|1639461600000|1|1|||SC
718|b194da63-feea-5bf2-899b-047fb448e46a|8pqln31jo8jfv|Force Reactions |Expanding on the physics based reactions to physical forces. Actors are made to stagger and collide with their environment and experience inertia, regardless of being the pilot.|1609718400000|1624492800000|1637109750000|1639461600000|3|4||20|SC,SQ42
719|13019f0b-49f2-5bc1-abae-589974a6f912|k54i8xfwov1s9|Gravlev Physics Rework|A significant rework of the flight and driving model for gravlev vehicles when hovering. The aim is to improve general feel and stability, resulting in a far better experience for players using hover bikes.|1634342400000|1636675200000|1637111169000|1639461600000|1|2||121|SC
720|5fce9544-220c-566c-98cf-ddfff8a0ee8d|k58vfj18sr1oc|Greycat PTV Gold Standard|Implementing, polishing, and optimizing all features required to bring the Greycat PTV to gold standard.|1642377600000|1645142400000|1621427391000|1639461600000|1|1|||SC
721|5da1eff8-2183-57fd-9c9d-159a253e4654|33474a7cs0v1j|Hacking T0|All back-end tech tasks related to creating the first pass of the hacking feature that will be used in future location and mission updates. When implemented in-game this feature will be used to access systems and areas that have been previously closed to the player. The hacking process will be represented via a minigame that is displayed on the player's HUD visor.|1609718400000|1650585600000|1617820897000|1639461600000|4|8||78|SC,SQ42
722|7d44696b-dd2e-544a-a11d-1a45f73fb06a|g0e6jgobpwt5h|Hangar Manager App V1|Creating a mobiGlas app that emulates the functionality of ASOP terminals, allowing players to spawn ships, claim insurance and access the array of landing services to maintain their ships.|1625443200000|1631232000000|1622667896000|1639461600000|1|1||25|SC
723|2008545b-c03f-599a-8aa6-2bc6da925241|cm3gk608pu8nm|Harvestables/Minables|Adding the first iteration of 'looting'. This involves spawning weapons, bottles of water, MedPens, and clothing at various locations that the player can find, store, and use.|1609718400000|1635465600000|1618252959000|1639461600000|2|2|||SC
724|a3daa249-99f1-5578-8b30-1a34da60f1c5|1t0rebloslqmu|Inventory Unstow|&quot;Unstow&quot; refers to fetching an item from an inventory and placing it into a Shard. For example, a ship loaded with cargo being unstowed, removes the ship and it's associated cargo from the inventory and places them into the game. This work implements moving an item's persistent data from an inventory into a Shard managed by the EntityGraph, and adding the item to the Replication Layer.|1626652800000|1638835200000|1626277393000|1639461600000|1|2|||SC
725|94377bf4-ec6b-5c42-9521-1aeac7818d21|8d5dyn9wigqwy|Jump Points|Building out the functionality, visual, and audio effects for the jump points used to travel between systems, and setting them up in-game. Including necessary vehicle items and functionality, the jump points themselves, and their inner tunnels.|1613779200000|1664409600000|1608315015000|1639461600000|3|5|||SC,SQ42
726|a7a7e450-71a9-58bb-a6f0-b350a09804d7|3fbborm2578lc|Life Support T0|Implementing the first iteration of onboard life support systems in ships, which entails a ship component that generates air when turned on, and management of said life support component within the vehicle loadout manager.|1618790400000|1655856000000|1620229996000|1639461600000|3|3|||SC
727|9a3f3c0a-e0e9-5926-8fd1-93637d0ea830|c4lf55bwkyfo1|Long Distance Probing|This feature will allow players to launch quantum-traveling probes that can detect signatures at extreme ranges far beyond the reach of ship scanners. The signatures can ultimately be used to identify point-of-interest and plan quantum travel.|1643760000000|1646092800000|1608567709000|1639461600000|1|1|||SC
728|867d4db1-b053-5694-9c7b-d805248fdfc7|bfkqi5r7dvz1f|Loot Generation T0|Implementing the systems that generate containers throughout the persistent universe (crates/lockers/boxes) that contain dynamically populated, randomized loot.|1614729600000|1629158400000|1637109993000|1639461600000|4|5||125|SC
729|f3d3ae91-f986-5057-96d1-fa82e3cb3de2|mbmjis7brhzg7|Loot Generation T1|This system deals with the generation of lootable containers throughout the world, their contents and how they can be accessed/broken in to.|1628899200000|1655856000000|1617825005000|1639461600000|4|2|||SC
730|bc5bb07a-35b4-5068-9201-565306fab77b|mckqpqjm2zzyb|Mag Stripping/Refill|This will allow players to strip found weapons of their ammunition. They can then remove each bullet and refill their own magazines manually or via a bullet reloader. This is only compatible with ballistic ammunition.|1610323200000|1664409600000|1617821107000|1639461600000|3|2|||SC,SQ42
731|94821297-af55-5793-87e1-c42d0751ea84|x238xrlu46brf|MFD Rework|We will both rebuild ship MFDs with our new Building Blocks UI technology, as well as completely redesign them in an effort to make them more customizable, better matched to ship aesthetics, and better at serving ship gameplay.|1612569600000|1664409600000|1608315057000|1639461600000|1|1|||SC,SQ42
732|4dfa2354-bd92-5d51-a488-a51bcf3cf4f6|0hjlqfcbfi08b|Mining Gadgets|Mining Gadgets will help to modify the rock and assist the player with mining a Deposit. The player can attach a device physically to a mineable deposit in FPS to modify its stats, making mining either easier and safer, or quicker and riskier.|1612224000000|1637625600000|1637110305000|1639461600000|4|4||126|SC
733|8d422c7c-6f2d-535d-a285-021999c1f1f5|i7j6aonq4inm9|MISC Hull A|Encompasses all tasks, including design, art, audio, and tech required for the implementation of the MISC Hull-A cargo hauler in the PU.|1624838400000|1644883200000|1637110258000|1639461600000|3|3||32|SC
734|e5975c1a-6422-5621-a958-a9e16ee479ee|amfnzbir75lb4|MISC Hull C|Encompasses all tasks, including design, art, audio, and tech, required for the implementation of the MISC Hull-C heavy cargo hauler into the PU.|1615161600000|1646092800000|1637110282000|1639461600000|5|7||127|SC,SQ42
735|209fef43-62b7-5b06-859c-f76c2211c986|sabjwr0nd84br|MISC Hull D|Building, implementing, and balancing MISC's heavy cargo hauler, the Hull D, as a flight-ready vehicle.|1644192000000|1645142400000|1621427941000|1639461600000|1|1|||SC
736|bc7fe94f-24bc-5450-abe7-dec06306599d|nurluoxzk366g|MISC Hull E|Building, implementing, and balancing MISC's heavy cargo hauler, the Hull E, as a flight-ready vehicle.|1649030400000|1653004800000|1621428000000|1639461600000|1|1|||SC
737|0a9d01a8-1b76-5624-ac0d-776c2578dd5e|p40oybrrk0ar1|MISC Odyssey|Building, implementing, and balancing MISC's exploration vessel, the Odyssey, as a game-ready vehicle.|1618790400000|1651795200000|1638239230000|1639461600000|2|2|||SC
738|99adee3b-48a2-5bc1-b939-664bf41fd602|qvviufr1cqczy|Miscellaneous Support|Includes general support for other teams, updating existing features, or small tasks that don't necessitate a full entry. |1609459200000|1664409600000|1611764538000|1639461600000|6|34|||SC,SQ42
739|8fc0f7f5-fcbe-5bf6-a6d6-979c1abbc1b6|i3r05bbupxmeb|Missile Operator Mode|Missiles will now be controlled under a dedicated missile operator mode, which gives players the option to select and fire specific missiles while operating in ships, such as the Vanguard, which allow for different types of missiles and torpedoes.|1609891200000|1624579200000|1637110251000|1639461600000|2|3||34|SC,SQ42
740|47230437-2be5-56c3-97da-a893f82db32c|df7yfomll04bv|Mounted Guns|Further expanding the player's arsenal by allowing them to take control of a mounted gun on either a vehicle or the ground. These weapons will offer greater firepower and stability at the cost of mobility.|1610323200000|1626998400000|1637110305000|1639461600000|3|3||80|SC,SQ42
741|0e540798-8246-52bd-90bd-5899866fbca0|n12wiexq0luvq|NPC Scheduler Service|The NPC Scheduler is meant to add and remove NPC's to the game, dynamically spawning them into and out of the 'verse based on NPC Archetype, Maximum number of NPC's in a given area, and the probabilities of those NPC Archetypes.|1614556800000|1661990400000|1608756893000|1639461600000|3|2|||SC
742|4386d39c-74ef-5b9b-8104-30162ad5fe33|xkooq3xm80s9n|Origin 400i|Building, balancing, and implementing Origin's luxury explorer, the 400i, into the game.|1610928000000|1634256000000|1637110293000|1639461600000|3|5||130|SC
743|29124bcb-a4c7-5ed1-bbff-d15d0b3e01b4|rhvp95yohx0pl|Origin 600i Gold Standard|Implementing, polishing, and optimizing all features required to bring the Origin 600i to gold standard.|1633305600000|1659571200000|1621428079000|1639461600000|2|3|||SC
744|dd2325a3-f865-5d03-b927-6f770ae9a5b6|xz7mai18yr9xs|Origin X1|Building, implementing, and balancing Origin's hover bike, the X1, as a flight-ready vehicle.|1643587200000|1656028800000|1634591893000|1639461600000|1|1|||SC
745|3c13afeb-5cbd-5535-8dd9-12436a5a5962|3afoobey8jbar|Orison V2|Improving Crusader's landing zone with more shops and expanding various services around the city.|1625529600000|1631577600000|1637110202000|1639461600000|4|7||132|SC
746|b1bfbc8f-6080-5466-98df-213aba18e508|ccfyr0am368p5|Persistent Habs|Work that grants players the ability to have their own Persistent Habs.|1633910400000|1636070400000|1617828206000|1639461600000|2|1|||SC
747|4a7916ce-6a37-5a3f-8a18-dcea03c677b4|x8mdafa7ky5dn|Persistent Hangars|"Work that grants players the ability to have their own Persistent Hangars. This will also bring changes to the Cargo gameplay loop by allowing players to pack their grids manually.
"|1620604800000|1638489600000|1637110207000|1639461600000|3|1||45|SC
748|ce514086-607f-585e-8939-d537e09609ee|22qmiobcit64m|Persistent Streaming and Server Meshing|Proprietary Server Meshing and Persistence Technology will allow Star Citizen to scale up it's shared universe across game servers. Eventually this technology will allow thousands of players to co-exist in the verse. Once the first version of this is implemented the number of servers and players will increase over successive versions.|1609459200000|1664409600000|1611716163000|1639461600000|3|14|||SC
749|b30536f9-3b0f-5985-a584-07ed66a17b66|wfonoo5iyj4pf|Physical QT Movement|Perform the QT movement within physics, along with efficient empty space checks along the QT path to determine when to drop out of QT if a potential intersection might occur. |1625443200000|1636329600000|1611716222000|1639461600000|1|1|||SC,SQ42
750|628c38b8-5eff-5705-a5f8-01f2a36e61dc|kjcb0qsrzliv5|Physical/Local Inventory Support|Adjusting shops and VMA to support the required API changes for local/physical inventory for players. Some of the transaction code will also be refactored, and several additional debugging options are being added so that we can identify problems and resolve bugs faster. The VMA will be updated so a player can only adjust their ship's loadout if they are in a location where they are currently storing other ship related items. |1616976000000|1625184000000|1637110196000|1639461600000|1|1||134|SC
751|1ffc09b8-c9db-5972-af18-4bfd0c1d35cf|5mxgx5pxu2ycx|Player Interaction Experience T1 - Lockers &amp; Inventory|Lockers T1 introduces a consistent way to store clothes, armor, and items in a physicalized state. Also includes a more robust and tactile method of storing items on shelves and attachment surfaces. This builds on the Personal Inventory, expanding the inventory UI to include lockers.|1630281600000|1664409600000|1617821822000|1639461600000|4|3|||SC,SQ42
752|b60a7c1d-cfa9-50a5-96ee-265fad6936be|kkx43s3k54tnp|Player Interaction Experience T2 - Visor HUD &amp; Helmet|Builds on the existing heads-up display (HUD) with a new look and feel. Includes a new equip and remove experience, boot-up and power-down sequences, and transitions between FPS and ship HUDs.|1645228800000|1664409600000|1608324683000|1639461600000|3|1|||SC,SQ42
753|4fdeb77f-de0f-5603-add4-cc64f3e4f9e6|ze5g3do3lijlm|Pyro Space Stations|Adding small rundown Rest Stop stations to the Pyro system, which provide basic services and use limited interiors.|1617321600000|1664409600000|1609780556000|1639461600000|3|6|||SC
754|0d7384c4-8ebb-5e16-9e6a-ff7387b71dd1|5jx5bc18cdok9|Quantum Simulation|Revealed at CitizenCon 2019, the Quantum Simulation will serve as the background economy for Star Citizen. Thousands of unseen simulated entities will carry out trade, commerce, piracy, and security to populate and inform other game systems.|1609459200000|1664409600000|1608319607000|1639461600000|2|1|||SC
755|f05e50b1-49e9-56c6-ad40-1279a8ff1161|ffao511sfca0t|Quantum Travel Experience|Updating Quantum Travel mechanic to move players in a more physically realistic way, and improve the general QT experience, adjusting how spooling/calibrating, interdictions and entering/exiting work.|1626912000000|1647302400000|1622668177000|1639461600000|2|1|||SC
756|4c33afa2-7288-5601-ae12-ec2523028ca7|8iluqwhkk0gvh|Radar, Scanning, and Ping|Radar is used to passively locate and track contacts, and display their whereabouts to the player. Scanning is used to obtain information about a specific entity. Ping actively finds additional contacts, or highlights volumes of space to investigate weak signatures, both of which are displayed via the radar and its AR HUD elements.|1609718400000|1627948800000|1637110280000|1639461600000|3|4||49|SC,SQ42
757|33baac98-ff3c-5c02-b1db-c33581e11bbb|7fzexivkf2skk|Reststop Hangar Replacements|Creating exterior pieces for small and medium Hangars that allow them to look and function properly as part of overall space station exteriors.|1626220800000|1640044800000|1624672178000|1639461600000|2|3|||SC
758|fdc99b0d-9451-5351-b36c-e693e4ac5555|8zvtskxqupmwm|Reward Service |Developing and implementing back-end systems capable of tracking stats and data per player, and awarding in-game rewards to them, as well as collecting, persisting and querying those player rewards|1641340800000|1658361600000|1622667448000|1639461600000|1|1|||SC
759|d4339226-a1e5-50f7-8e9a-7f8c7f16f511|rsulbse2zjhh3|Rivers and Basins|This tool allows rivers and basins to be further developed and readied for production use, in order to enhance the ecosystems of our planets. |1625616000000|1640044800000|1629831635000|1639461600000|3|3|||SC
760|cb1e08d0-98b2-52d7-9df0-4737e9be845d|bhuufmvljiwzk|RSI Constellation Taurus|Implementing and balancing RSI's hauling variant of the Constellation, the Taurus, as a flight ready ship in the game.|1610323200000|1625788800000|1637110290000|1639461600000|4|4||53|SC
761|ceb26298-ab16-5c72-ab4c-6d4f494358a2|n76pv7fpvwnlk|RSI Orion|Building, implementing, and balancing RSI's mining platform, the Orion, as a flight-ready vehicle.|1653868800000|1660867200000|1628644173000|1639461600000|1|1|||SC
762|a3900f7e-9922-5ea1-a8f4-47b12746a2e8|7taofwzl35i1p|RSI Scorpius|Building, implementing, and balancing RSI's heavy fighter, the Scorpius, as a flight-ready vehicle.|1609718400000|1651190400000|1637110287000|1639461600000|3|4||54|SC
763|ac25cd35-5dc9-5b4d-8e7a-32a047f6fafa|cex1wivftqaw6|Salvage T0|All back-end tech tasks related to creating the first pass of the salvage feature that will be used in future location and mission updates.|1618876800000|1652400000000|1637110316000|1639461600000|3|7||135|SC,SQ42
764|ef26e5bb-a58b-5efe-ba37-b4d8dbfcd06f|zojrooozmn197|Selling|This feature deals with the ability to sell items back to the shops. Players will have the ability to sell items from their local inventory to the shop using our Building Blocks Tech. This will also support a generalized loot system that will fill lockers and enemy's backpacks with a random assortment of items that can be looted and then taken back to shops to sell for money.|1619395200000|1643673600000|1635891158000|1639461600000|3|3||104|SC
765|e1a5334b-491e-53c8-86db-0d1be6f33b8b|76q2pncnt94b4|Shield Emitters|Converting ship shield-emitters into physical objects that can be targeted and destroyed, giving players the ability to permanently disable enemy shields.|1618790400000|1646092800000|1617821843000|1639461600000|2|2|||SC,SQ42
766|440f298b-c769-564d-9f3c-2431615432a5|k344glls3rfaq|Ship CPU|Designing and implementing computer blades for ships. Includes various blades that can be used to modify or improve certain aspects of a ship's functionality, such as unlocking more complex targeting abilities. |1611187200000|1664409600000|1611711273000|1639461600000|2|1|||SC,SQ42
767|6cc2b971-7850-5944-9928-dfccd51d2726|q6m1tl7dwqpa9|Ship to Ship Refueling|Implementing the systems that will allow players flying specific ships to refuel other ship and get paid for it. The player can fill those specific ships' fuel tanks from a station using an updated Rearm, Restock, Refuel interface at Landing Zones and Space Stations.|1614729600000|1639094400000|1637110268000|1639461600000|4|8||136|SC
768|ac96452b-91d2-5a95-b8d6-75954a9fd948|8kheqq3ulsd3y|Shops and Patrons|Vastly expand the interactive usables needed for an assortment of shops and patrons. We will be populating dozens of shops with the &lsquo;vendor&rsquo; behavior previously seen in the bartender. This will include the Coffee Stand, Pizza bar, Kiosks, and more |1616716800000|1638403200000|1637110084000|1639461600000|5|7|||SC
769|164d5ff7-d6b5-535b-9bc8-ca7387aaf60f|no588vjuwt8q7|Solar Burst|Solar Bursts are dangerous natural disasters that happen regularly around older stars like Pyro. In these instances, the sun erupts with an high energy particle wave, generated from its surface, traveling at 15% the speed of light through the entire star-system. This dangerous high energy particle wave can be avoided by hiding behind other objects that are big enough.|1632873600000|1640044800000|1637111268000|1639461600000|2|1|||SC
770|423e8564-33db-5dae-9c37-35743336fd21|udvlalbibuwg4|Space Mines|In space, players in certain ships will gain the ability to release different types of space mines in a coordinated fashion, in an attempt to trap, damage and capture enemies, or set up defensive perimeters.|1649030400000|1664409600000|1628644777000|1639461600000|1|2|||SC
771|eb8e8627-7588-52b5-b543-cc60c65eee2d|0kxmdtm67rgak|Spectrum Party Sync|Creating the ability to create a new party or view your current party in Spectrum.|1630454400000|1660780800000|1622667474000|1639461600000|1|1|||SC
772|0b8b25fb-8b7a-5bcc-957b-f136246d09f3|w489uig8qdbov|SQ42 - Vehicle Support|Polishing and iterating on various vehicles needed for the Squadron 42 single-player campaign.|1610323200000|1660780800000|1608591931000|1639461600000|5|6|||SQ42
773|2de96419-aea4-5740-b154-7aa6f55e5425|3hgcaihdi8ihr|System Broadcaster|Implementing a system that enables the scheduling of various types of server-wide communications to players.|1652054400000|1663200000000|1629903810000|1639461600000|1|1|||SC
774|c4dd6d7a-8d3c-5dff-89fa-5287a2688dfb|yiu46zy38uxhe|Unannounced|Unannounced Content|1612224000000|1637884800000|1608322444000|1639461600000|6|10|||SC
775|ff4e0225-a35a-5872-88ad-3d114fbe240a|cfejzq4w7diwo|Unannounced|Unannounced Vehicle|1624838400000|1639699200000|1617842490000|1639461600000|4|5|||SC
776|a3568196-0f0d-597c-a989-a4e1cc1fdb27|lgp176y28996t|Unannounced|Unannounced Vehicle|1618185600000|1644883200000|1618731734000|1639461600000|4|6|||SC
777|1f128812-9079-5d46-84e3-df83a90ad87f|gxiq4mofoiisf|Unannounced|Unannounced Vehicle|1625443200000|1656028800000|1621362028000|1639461600000|2|4|||SC
778|ffdd3f48-e087-581f-bffb-3ddbf9474c5a|0up363xa5n547|Unannounced|Unannounced Content|1625529600000|1645142400000|1621427495000|1639461600000|2|2|||SC
779|5222ae51-0b03-54e6-a018-e107fff2a2b1|etcbsx704u47q|Unannounced|Unannounced Tech|1630454400000|1664409600000|1621362094000|1639461600000|1|1|||SC
780|70f78c21-aad2-5f2e-9ff3-bbe7ef93cee1|qmctvvm9x5g69|Unannounced|Unannounced Vehicle|1650240000000|1663286400000|1637191134000|1639461600000|1|1|||SC
781|c0fd738f-93d0-5013-b4a7-a551618654c7|sit96ssmluwzy|Unannounced|Unannounced Vehicle|1635724800000|1663891200000|1637111203000|1639461600000|1|2|||SC
782|f8e1ebf6-3a82-5519-a8d2-bfe65993c8a3|ha4shc2o3egn9|Unannounced|Unannounced Vehicle|1644192000000|1652400000000|1637111195000|1639461600000|1|1|||SC
783|28e4f5e4-c198-5a35-83b5-3b47bbc9fb81|b78fhgwubcv54|Unannounced|Unannounced Vehicle|1656892800000|1664496000000|1637111184000|1639461600000|1|1|||SC
